{
  "config_version": "1.0",
  "mode": "alpaca_paper",
  "description": "Alpaca PAPER brokerage adapter (Step 41). Paper account only, fixed endpoint, explicit commands, long-only whole-share day limit orders in the regular session. No real money, no automatic orders, no polling.",
  "data_feed": "iex",
  "allowed_time_in_force": [
    "day"
  ],
  "kill_switch": {
    "engaged": false,
    "note": "Set true, or run broker-paper-kill-switch engage, to block new paper submissions. Status checks and cancellation stay allowed."
  },
  "limits": {
    "max_order_notional": "1000.00",
    "max_position_notional": "2000.00",
    "max_quantity": 100,
    "max_open_orders": 3,
    "max_submissions_per_day": 5,
    "min_limit_price": "1.00",
    "max_limit_above_ask_bps": "50",
    "max_limit_below_bid_bps": "500",
    "max_spread_bps": "100",
    "max_quote_age_seconds": 30,
    "max_clock_skew_seconds": 15,
    "min_seconds_before_close": 300,
    "intent_ttl_seconds": 900,
    "not_found_settle_seconds": 60
  },
  "network": {
    "timeout_seconds": 15,
    "max_response_bytes": 1000000,
    "max_open_orders_listed": 100
  }
}
